{
  "schemaVersion": "1.0",
  "id": "novasaga-engine-fixture",
  "title": "NovaSaga",
  "subtitle": "Choose a direction. The world expands from there.",
  "theme": {
    "palette": {
      "background": "#f2efe7",
      "foreground": "#263b47",
      "surface": "#fffdf8",
      "muted": "#74818a",
      "accent": "#9a674e"
    },
    "typography": {
      "tone": "editorial"
    },
    "motion": {
      "pace": "slow"
    },
    "composition": {
      "density": "airy",
      "mediaWeight": "balanced"
    }
  },
  "entryPolicy": {
    "maxDirections": 5,
    "preferDiversity": true
  },
  "packages": [
    {
      "schemaVersion": "1.0",
      "id": "sunset-moonland",
      "kind": "place",
      "title": "Sunset Moonland",
      "summary": "A post-Cessation settlement beside deep blue water, shaped by exile, arrival and the possibility of belonging.",
      "entry": {
        "priority": 4,
        "featured": true
      },
      "tags": [
        "community",
        "water",
        "belonging"
      ],
      "theme": {
        "palette": {
          "background": "#f6efe1",
          "foreground": "#2a3e47",
          "surface": "#fffaf1",
          "muted": "#6f7a78",
          "accent": "#b56b4f"
        },
        "composition": {
          "mediaWeight": "dominant",
          "density": "airy"
        }
      },
      "blocks": [
        {
          "id": "sm-hero",
          "type": "hero",
          "title": "Sunset Moonland",
          "subtitle": "A place that can become home before you realize you stopped leaving."
        },
        {
          "id": "sm-prose",
          "type": "prose",
          "heading": "The place",
          "paragraphs": [
            "Sunset Moonland is not important because it has escaped hardship. Its importance comes from a social fabric where the personal still reaches the system.",
            "Its history accumulates across eras: exile, rediscovery, settlement, and finally the arrival of people who were only trying to pass through."
          ]
        },
        {
          "id": "sm-timeline",
          "type": "timeline",
          "heading": "Layers of the place",
          "items": [
            {
              "id": "sm-t1",
              "label": "≈ 500 years earlier",
              "title": "An exile finds the land",
              "summary": "A Luminary child in permanent exile withdraws here and slowly changes."
            },
            {
              "id": "sm-t2",
              "label": "Before the Cessation",
              "title": "A fisherman returns",
              "summary": "A storm reveals the place; he later comes back with his wife."
            },
            {
              "id": "sm-t3",
              "label": "After the Cessation",
              "title": "A community forms",
              "summary": "Travelers begin to stay."
            }
          ]
        },
        {
          "id": "sm-rel",
          "type": "relationships",
          "heading": "Threads leaving the place"
        }
      ],
      "relationships": [
        {
          "id": "sm-lucas",
          "targetId": "lucas-menezes",
          "label": "changes"
        },
        {
          "id": "sm-cessation",
          "targetId": "cessation",
          "label": "reshaped by"
        },
        {
          "id": "sm-proving",
          "targetId": "silent-proving",
          "label": "echoes"
        }
      ]
    },
    {
      "schemaVersion": "1.0",
      "id": "lucas-menezes",
      "kind": "person",
      "title": "Lucas Menezes",
      "summary": "A young environmental engineering student whose instinct to help becomes both his magnetism and his burden.",
      "entry": {
        "priority": 3
      },
      "tags": [
        "Brazil",
        "empathy",
        "journey"
      ],
      "theme": {
        "palette": {
          "background": "#edf4ef",
          "foreground": "#24413f",
          "surface": "#fbfdf9",
          "muted": "#6a7f7a",
          "accent": "#4e8a7e"
        },
        "composition": {
          "mediaWeight": "dominant"
        }
      },
      "blocks": [
        {
          "id": "lucas-hero",
          "type": "hero",
          "title": "Lucas Menezes",
          "subtitle": "He notices need before he notices his own exhaustion."
        },
        {
          "id": "lucas-prose",
          "type": "prose",
          "paragraphs": [
            "Lucas is defeated by scale rather than cruelty. The more he helps, the more clearly he sees what remains undone.",
            "His arc is not about caring less. It is about learning that feeling another person's pain does not create an obligation to personally solve everything."
          ]
        },
        {
          "id": "lucas-quote",
          "type": "quote",
          "text": "Feeling deeply does not require carrying everything."
        },
        {
          "id": "lucas-rel",
          "type": "relationships"
        }
      ],
      "relationships": [
        {
          "id": "lucas-sm",
          "targetId": "sunset-moonland",
          "label": "arrives at"
        },
        {
          "id": "lucas-cess",
          "targetId": "cessation",
          "label": "survives"
        }
      ]
    },
    {
      "schemaVersion": "1.0",
      "id": "cessation",
      "kind": "event",
      "title": "The Cessation",
      "summary": "A global failure of engineered electrical conduction that collapses systems while leaving biological electrochemistry intact.",
      "entry": {
        "priority": 5,
        "featured": true
      },
      "tags": [
        "world event",
        "collapse",
        "ambiguity"
      ],
      "theme": {
        "palette": {
          "background": "#f0e8e1",
          "foreground": "#3b3031",
          "surface": "#faf5f0",
          "muted": "#7a6967",
          "accent": "#b94e40"
        },
        "composition": {
          "density": "balanced",
          "mediaWeight": "dominant"
        }
      },
      "blocks": [
        {
          "id": "cess-hero",
          "type": "hero",
          "title": "The Cessation",
          "subtitle": "Technology fails faster than people can understand why."
        },
        {
          "id": "cess-prose",
          "type": "prose",
          "paragraphs": [
            "The Cessation is a systems failure, not a clean reset. Water, food, medicine, transport, communications and public trust fail on different clocks.",
            "At the same time, weakened boundaries make the hidden world easier to encounter precisely when people have the least capacity to interpret it."
          ]
        },
        {
          "id": "cess-timeline",
          "type": "timeline",
          "heading": "Propagation",
          "items": [
            {
              "id": "c1",
              "title": "The disturbance begins"
            },
            {
              "id": "c2",
              "title": "Engineered conduction fails"
            },
            {
              "id": "c3",
              "title": "Cities lose coordination"
            },
            {
              "id": "c4",
              "title": "Local systems adapt"
            }
          ]
        },
        {
          "id": "cess-rel",
          "type": "relationships"
        }
      ],
      "relationships": [
        {
          "id": "cess-sm",
          "targetId": "sunset-moonland",
          "label": "reshapes"
        },
        {
          "id": "cess-lum",
          "targetId": "luminaries",
          "label": "exposes"
        },
        {
          "id": "cess-canvas",
          "targetId": "obscured-canvas",
          "label": "clears"
        }
      ]
    },
    {
      "schemaVersion": "1.0",
      "id": "silent-proving",
      "kind": "concept",
      "title": "The Silent Proving",
      "summary": "A Luminary child grows up without knowledge of lineage so that character can be observed through genuine life rather than staged tests.",
      "entry": {
        "priority": 3
      },
      "tags": [
        "selection",
        "agency",
        "character"
      ],
      "blocks": [
        {
          "id": "sp-hero",
          "type": "hero",
          "title": "The Silent Proving",
          "subtitle": "Worthiness cannot be inherited."
        },
        {
          "id": "sp-process",
          "type": "process",
          "heading": "The structure",
          "items": [
            {
              "id": "sp1",
              "title": "Birth",
              "summary": "The family knows; the child does not."
            },
            {
              "id": "sp2",
              "title": "Ordinary life",
              "summary": "The family lives among ordinary humans."
            },
            {
              "id": "sp3",
              "title": "Observation",
              "summary": "Choices are watched without intervention."
            },
            {
              "id": "sp4",
              "title": "Return or exile",
              "summary": "Lineage is revealed only if readiness is real."
            }
          ]
        },
        {
          "id": "sp-rel",
          "type": "relationships"
        }
      ],
      "relationships": [
        {
          "id": "sp-lum",
          "targetId": "luminaries",
          "label": "belongs to"
        },
        {
          "id": "sp-sm",
          "targetId": "sunset-moonland",
          "label": "echoes in"
        }
      ]
    },
    {
      "schemaVersion": "1.0",
      "id": "luminaries",
      "kind": "faction",
      "title": "The Luminaries",
      "summary": "A hidden tradition concerned with perception, balance, restraint and the responsibility that comes with greater capability.",
      "entry": {
        "priority": 4
      },
      "tags": [
        "balance",
        "restraint",
        "hidden order"
      ],
      "blocks": [
        {
          "id": "lum-hero",
          "type": "hero",
          "title": "The Luminaries",